{
  "$schema": "https://json-schema.org/draft/2020-12/schema",
  "$id": "scene.schema.json",
  "title": "scenes.json (씬 계약)",
  "description": "[3s. scenetable]의 산출물이자 씬 계약 소비자 단계의 읽기 전용 입력 (ADR-0049 §5·0052). 사람이 읽는 근거는 specs/02-beat-schema.md에 있고, 기계가 읽는 계약은 이 파일이다 (ADR-0034 §3).",
  "type": "object",
  "required": [
    "run_id",
    "topic",
    "total_duration",
    "scenes"
  ],
  "additionalProperties": false,
  "properties": {
    "run_id": {
      "type": "string",
      "minLength": 1
    },
    "topic": {
      "type": "string",
      "minLength": 1
    },
    "total_duration": {
      "type": "number",
      "exclusiveMinimum": 0
    },
    "characters": {
      "type": "array",
      "minItems": 1,
      "description": "선택. 여러 씬에 반복 등장하는 인물의 정의 (ADR-0051). [3s]가 '같은 인물이 2씬 이상 반복 등장하고 서사를 지는가'를 판정해 필요할 때만 적는다. 없으면 인물 경로([6]의 시트 생성·참조 주입) 전체가 스킵된다 — 부재는 경고가 아니다 (D-3).",
      "items": {
        "type": "object",
        "required": [
          "id",
          "name",
          "appearance"
        ],
        "additionalProperties": false,
        "properties": {
          "id": {
            "type": "string",
            "pattern": "^[a-z][a-z0-9_]*$",
            "description": "씬의 cast가 가리키는 키."
          },
          "name": {
            "type": "string",
            "minLength": 1,
            "description": "한국어 이름 (대본 표기)."
          },
          "anchor": {
            "type": "string",
            "minLength": 1,
            "description": "선택. 1차 자료 언어의 고유명사 (ADR-0042)."
          },
          "appearance": {
            "type": "string",
            "minLength": 1,
            "description": "외형 서술 한국어 구절 — 시트 프롬프트와 cast 씬 프롬프트에 그대로 들어간다 (ADR-0027)."
          }
        }
      }
    },
    "scenes": {
      "type": "array",
      "minItems": 1,
      "items": {
        "$ref": "#/$defs/scene"
      }
    }
  },
  "$defs": {
    "scene": {
      "type": "object",
      "description": "씬 1개 = 자막 줄(SRT 큐) 1개 (ADR-0013).",
      "required": [
        "scene_id",
        "beat",
        "text",
        "est_start",
        "est_end",
        "visual_goal",
        "subject",
        "subject_scale",
        "camera"
      ],
      "additionalProperties": false,
      "properties": {
        "scene_id": {
          "type": "integer",
          "minimum": 1,
          "description": "1부터 연번. 자막 줄 순서와 일치한다."
        },
        "beat": {
          "$ref": "vocab.json#/$defs/beat",
          "description": "서사 기능의 라벨. 연출의 분기 기준이 아니다 (ADR-0033 §4)."
        },
        "text": {
          "type": "string",
          "minLength": 1
        },
        "est_start": {
          "type": "number",
          "minimum": 0,
          "description": "TTS 이전 추정치. 갱신되지 않는다 — 실측은 scenes.timed.json의 start/end다 (ADR-0017)."
        },
        "est_end": {
          "type": "number",
          "minimum": 0
        },
        "visual_goal": {
          "type": "string",
          "minLength": 1,
          "description": "이 그림이 지는 설명 (ADR-0022). text가 이미 말한 것을 되풀이하면 검증에서 걸린다."
        },
        "subject": {
          "type": "string",
          "minLength": 1,
          "description": "visual_goal을 달성할 핵심 피사체 (한국어). 이미지 프롬프트의 재료다."
        },
        "action": {
          "type": "string",
          "description": "선택. 이 클립 동안 subject에게 **무엇이 어떻게 변하는가** — 시작 상태 → 끝 상태 (한국어, ADR-0076). **빈 문자열은 키를 안 낸 것과 같다** (정물 씬) — 세션이 둘 중 무엇으로 말하든 받는다. notes와 같은 태도다. camera와 다르다: camera는 *카메라의* 움직임이고 action은 *피사체의* 변화다. [3s]가 대본 줄의 상황·행위에서 고른다. 비면 정물 씬이고 [5]가 ACTION 절을 만들지 않는다 — 전 씬이 비면 ADR-0076을 되돌릴 조건이다. **MJ는 이 값을 받지 않는다** (정지 이미지라 동작 서술이 모션블러로 나온다) — H3 등 영상 엔진만 받는다."
        },
        "subject_anchor": {
          "type": "array",
          "items": {
            "type": "string",
            "minLength": 1,
            "pattern": "\\S"
          },
          "description": "선택. 대상을 고정하는 짧은 명사구 목록 (ADR-0028). 고유명사는 소재의 1차 자료 언어로, 재질·정체 같은 일반 명사는 한국어로 적는다 (ADR-0042 — 한국어 「일본 …」은 한옥을 부른다). 부재는 경고가 아니다. 공백뿐인 항목은 막는다 — [5]가 subject 뒤에 콤마로 잇기 때문에 빈 항목이 프롬프트에 ', ,'로 남는다."
        },
        "subject_scale": {
          "$ref": "vocab.json#/$defs/subject_scale"
        },
        "framing": {
          "$ref": "vocab.json#/$defs/framing",
          "description": "선택. [3s]가 구도 토큰 어휘에서 고른다 (ADR-0033 §3). 없으면 [5]가 beat-defaults.json의 기본값으로 떨어지고 그 씬 수를 요약에 낸다."
        },
        "transition": {
          "$ref": "vocab.json#/$defs/transition",
          "description": "선택. 이 씬으로 **진입**하는 전환. 없으면 beat-defaults.json의 기본값이다. 첫 씬에서는 무시한다."
        },
        "camera": {
          "$ref": "vocab.json#/$defs/camera"
        },
        "shot2": {
          "type": "object",
          "required": [
            "framing",
            "camera"
          ],
          "additionalProperties": false,
          "properties": {
            "framing": {
              "$ref": "vocab.json#/$defs/framing"
            },
            "camera": {
              "$ref": "vocab.json#/$defs/camera"
            }
          },
          "description": "선택. 같은 피사체·무대의 두 번째 샷 — 있으면 2샷 씬 (ADR-0058). 샷 1은 이 씬의 framing·camera다. subject·staging·info는 씬 공통. [3s]가 어휘에서 고른다. 기본값은 없다 — 비우면 1샷. 컷 시각과 2샷 자격은 [7]이 정한다 (beat-defaults.json multishot)."
        },
        "cast": {
          "type": "array",
          "minItems": 1,
          "items": {
            "type": "string",
            "pattern": "^[a-z][a-z0-9_]*$"
          },
          "description": "선택. 이 씬에 등장하는 characters의 id (ADR-0051). [6]이 이 씬의 프롬프트에 캐릭터 시트 참조를 잇는다. 최상위 characters에 없는 id는 계약 위반이다."
        },
        "info": {
          "type": "object",
          "description": "선택. 화면 계측 표시 (ADR-0056 결정 3). [3s]가 단다. 존재하면 [5]가 RED 절을 넣고 [7]이 비전 검수로 확인한다. **정보를 지는 것은 device가 세우는 구도이고 표시(annotation)는 그 위의 주석이다** (ADR-0075 결정 5). labels는 화면에 그려질 문자열 그대로이고 ASCII만이다 — 한글·가나·한자는 자막이 진다 (ADR-0002). 문자열 속 수치는 factcheck.md가 검증한 것만 쓴다 (ADR-0007). target은 무엇을 재는지의 영어 서술(내용, 자유 기술), annotation은 표시 방식(어휘), device는 정보를 지는 구도 장치(어휘, 선택).",
          "required": [
            "labels",
            "target",
            "annotation"
          ],
          "additionalProperties": false,
          "properties": {
            "labels": {
              "type": "array",
              "minItems": 1,
              "maxItems": 4,
              "items": {
                "type": "string",
                "minLength": 1,
                "maxLength": 24,
                "pattern": "^[ -~]+$"
              },
              "description": "ASCII만. 숫자 + 단위(vocab unit)가 기본, 짧은 영어 단어(3단어 이하)도 된다."
            },
            "target": {
              "type": "string",
              "minLength": 3,
              "pattern": "^[ -~]+$",
              "description": "무엇을 재는지 — 영어 서술. 예: the diameter of the hole / how far the cable sags below its anchor line"
            },
            "device": {
              "$ref": "vocab.json#/$defs/info_device",
              "description": "선택. **정보를 지는 구도 장치** (ADR-0075 결정 5). 빨간 표시가 아니라 그림 자체가 정보를 지게 하는 방법이고, [5] 세션이 SUBJECT 단락에서 이 장치를 실제로 무대에 세운다. 어휘는 vocab.json meta.info_device. 비면 지금과 같이 돈다 — annotation만으로 간다."
            },
            "annotation": {
              "$ref": "vocab.json#/$defs/annotation"
            }
          }
        },
        "reference": {
          "$ref": "vocab.json#/$defs/reference_mode",
          "description": "선택. 실물 참조 사진을 first frame에 어떻게 물릴지 (ADR-0087). `[3s]`가 씬마다 고르고 `[6]`이 그 값을 IP-Adapter에 건다 — 값(weight·start_at)은 `vocab.json` `meta.reference_mode`가 진다. **빈칸이면 `_default`(`identity`)다.** `reference_frames` 라인의 `info` 없는 씬에서만 쓰이고, 다른 라인·`info` 씬에서는 무시된다. **참조 사진이 없는 씬은 어떤 값이든 참조 없이 그린다** — 강등이 아니다."
        },
        "notes": {
          "type": "string"
        },
        "staging": {
          "$ref": "vocab.json#/$defs/staging",
          "description": "선택. 무대 — studio(기술 모델) | location(실제 환경). [3s]가 고른다 (ADR-0056 결정 4). 비면 beat-defaults.json의 기본값."
        }
      }
    }
  }
}
